{
  "v": [
    { "id": 0, "part": 0 },
    { "id": 1, "part": 1 },
    { "id": 2, "part": 1 },
    { "id": 3 }
  ],
  "e": [
    { "id": 0, "attrs": { "spring": { "k": 20, "rest": 30 }, "weight": 1 } },
    { "id": 1, "attrs": { "weight": 2 } },
    { "id": 2, "attrs": { "type": "hyper", "weight": 1 } }
  ],
  "i": [
    { "v": 0, "e": 0 },
    { "v": 1, "e": 0 },
    { "v": 1, "e": 1 },
    { "v": 2, "e": 1 },
    { "v": 0, "e": 2 },
    { "v": 2, "e": 2 },
    { "v": 3, "e": 2 }
  ],
  "meta": {
    "schema": 1,
    "directed": false,
    "units": { "pos": "world", "radius": "px" }
  }
}
